{
  "apiVersion": "workspace.socioprophet.dev/v1",
  "kind": "SpFileNamingDecision",
  "metadata": {
    "decisionId": "sp-file-naming:2026-08-02-0001",
    "createdAt": "2026-08-02T18:30:00Z",
    "labels": {"surface": "drive", "agent": "sp-file-naming"}
  },
  "spec": {
    "agentId": "agent://prophet-workspace/sp-file-naming@v1",
    "declaredExtent": "extent://filing/SOCIOPROPHET",
    "mountAuthority": "none",
    "operation": "publish",
    "inputArtifactId": "workspace-artifact:docs/untitled-draft-2026-08-02",
    "canonicalName": "2026-08-02_architecture-decision-record_SP-ARCH-000_v1.md",
    "targetPath": "SOCIOPROPHET/architecture/decision-records",
    "proofArtifact": {
      "outputDigest": "sha256:5555555555555555555555555555555555555555555555555555555555555555",
      "publicationRef": "workspace://drive/SOCIOPROPHET/architecture/decision-records/2026-08-02_architecture-decision-record_SP-ARCH-000_v1.md",
      "inclusionRecord": "cover:SOCIOPROPHET/architecture/decision-records disjoint=true"
    },
    "policyRef": "policy://workspace/sp-file-naming",
    "evidenceCorrelationId": "sp-file-naming:2026-08-02-0001"
  }
}
